{
  "schema_version": "anvil-operation-catalog/v1",
  "provider": "project-bridge",
  "catalog_version": "1.0.0",
  "catalog_digest": "sha256:90e012a69c4aa5ebcec60f391d948a77c48bbf583632063c5b388cab7a75a563",
  "generated_at": "2026-07-19T00:00:00Z",
  "operations": [
    {
      "id": "bridge.github.commit_pr",
      "title": "Commit, push, and create a pull request",
      "summary": "Execute the existing bridge-local GitHub action only with a consumed commit_pr approval bound to the observed diff and target branch; return the committed head SHA for later merge approval.",
      "contract_version": "1.0.0",
      "operation_digest": "sha256:8aef716c52d7bf33f19a2829b56e7ad8f19cd5f1cce6cc6d5a10320410e512c3",
      "effect": "external_effect",
      "execution": {
        "kind": "bridge_adapter",
        "bridge_adapter": "bridge.github.commit_pr",
        "transport": "bridge_local",
        "deadline_seconds": 600
      },
      "input_schema": {
        "type": "object",
        "required": [
          "diff_hash",
          "branch",
          "title",
          "base"
        ],
        "properties": {
          "diff_hash": {
            "type": "string",
            "pattern": "^[a-f0-9]{64}$"
          },
          "branch": {
            "type": "string",
            "minLength": 1,
            "maxLength": 160
          },
          "title": {
            "type": "string",
            "minLength": 1,
            "maxLength": 240
          },
          "base": {
            "type": "string",
            "minLength": 1,
            "maxLength": 160
          }
        },
        "additionalProperties": false
      },
      "output_schema": {
        "type": "object",
        "required": [
          "pr_url",
          "diff_hash",
          "head_sha"
        ],
        "properties": {
          "pr_url": {
            "type": "string"
          },
          "diff_hash": {
            "type": "string"
          },
          "head_sha": {
            "type": "string",
            "pattern": "^[a-f0-9]{40,64}$"
          }
        }
      },
      "preconditions": [
        "bridge.lease_valid",
        "approval.commit_pr_consumed",
        "diff.hash_matches_approval"
      ],
      "gates": {
        "preview": "not_supported",
        "confirmation": "required",
        "human_approval": "required",
        "approval_action": "commit_pr"
      },
      "idempotency": {
        "key_scope": "approval_payload",
        "replay": "reconcile",
        "max_attempts": 1
      },
      "receipts": [
        "github_pr",
        "diff_hash",
        "head_sha"
      ],
      "failure": "reconcile",
      "docs": "docs/CONTRACTS.md#bridge-and-github-action-contract"
    },
    {
      "id": "bridge.github.merge_and_accept",
      "title": "Merge a pull request and request State acceptance",
      "summary": "Execute the bridge-local composite: verify the approved PR head and required checks, merge with a head compare-and-swap, then invoke the configured State apply command. A partial outcome becomes reconciliation.",
      "contract_version": "1.0.0",
      "operation_digest": "sha256:0a1c88d3200fe2771ac116de9c277e5d9b0bc8a6486ff9fa38fe05b6cad17cff",
      "effect": "external_effect",
      "execution": {
        "kind": "bridge_adapter",
        "bridge_adapter": "bridge.github.merge_and_accept",
        "transport": "bridge_local",
        "deadline_seconds": 900
      },
      "input_schema": {
        "type": "object",
        "required": [
          "pr",
          "task_ref",
          "expected_head_sha"
        ],
        "properties": {
          "pr": {
            "type": "string",
            "minLength": 1,
            "maxLength": 500
          },
          "task_ref": {
            "type": "string",
            "pattern": "^[a-z0-9][a-z0-9._-]{0,63}:T[0-9]{3}(\\.[0-9]{1,3})?$",
            "description": "A scoped <prd_id>:<task_id> reference; the owning PRD is mandatory."
          },
          "expected_head_sha": {
            "type": "string",
            "pattern": "^[a-f0-9]{40,64}$"
          }
        },
        "additionalProperties": false
      },
      "output_schema": {
        "type": "object",
        "required": [
          "pr",
          "task_ref",
          "head_sha",
          "state_acceptance"
        ],
        "properties": {
          "pr": {
            "type": "string"
          },
          "task_ref": {
            "type": "string"
          },
          "head_sha": {
            "type": "string",
            "pattern": "^[a-f0-9]{40,64}$"
          },
          "state_acceptance": {
            "type": "object",
            "description": "Redacted State apply result or opaque receipt reference."
          }
        }
      },
      "preconditions": [
        "bridge.lease_valid",
        "approval.merge_and_accept_consumed",
        "github.head_matches_approval",
        "github.required_checks_pass",
        "github.merge_observed"
      ],
      "gates": {
        "preview": "not_supported",
        "confirmation": "required",
        "human_approval": "required",
        "approval_action": "merge_and_accept"
      },
      "idempotency": {
        "key_scope": "approval_payload",
        "replay": "reconcile",
        "max_attempts": 1
      },
      "receipts": [
        "github_merge",
        "state_acceptance"
      ],
      "failure": "reconcile",
      "docs": "docs/CONTRACTS.md#bridge-and-github-action-contract"
    }
  ]
}
