{
  "schema_version": "anvil-operation-catalog/v1",
  "provider": "anvil-state",
  "catalog_version": "1.0.0",
  "catalog_digest": "sha256:b00800723b8f89fa300d30d854500d9c6fdc7aa2d8b2c62b03ad7baab7b26120",
  "generated_at": "2026-07-19T00:00:00Z",
  "operations": [
    {
      "id": "state.task.claim",
      "title": "Claim a State task",
      "summary": "Acquire a task lease through the supported State CLI/MCP surface in the bridge-resolved leased worktree, then attest the selected branch before Codex starts.",
      "contract_version": "1.0.0",
      "operation_digest": "sha256:ec20c724a2da09f742621ad779ea3a61a106b4939e8cfb62e9426706299c9c28",
      "effect": "state_mutation",
      "execution": {"kind": "bridge_adapter", "bridge_adapter": "state.cli.claim", "transport": "state_cli", "deadline_seconds": 60},
      "input_schema": {"type": "object", "required": ["task_id", "actor", "worktree_name"], "properties": {"task_id": {"type": "string"}, "actor": {"type": "string"}, "worktree_name": {"type": "string", "description": "A bridge-configured leased worktree name, never a path."}}, "additionalProperties": false},
      "output_schema": {"type": "object", "required": ["claim_id", "event_id", "branch"], "properties": {"claim_id": {"type": "string"}, "event_id": {"type": "string"}, "branch": {"type": "string"}}},
      "preconditions": ["bridge.connected", "bridge.lease_valid", "worktree.configured", "task.ready", "task.unclaimed_or_owned"],
      "gates": {"preview": "not_supported", "confirmation": "not_required", "human_approval": "not_required", "approval_action": null},
      "idempotency": {"key_scope": "run_step", "replay": "return_prior_receipt", "max_attempts": 1},
      "receipts": ["state_claim", "state_event"],
      "failure": "reconcile",
      "docs": "docs/CONTRACTS.md#anvil-state-contract"
    },
    {
      "id": "state.evidence.submit",
      "title": "Submit State evidence",
      "summary": "Submit independently captured verification and declared changed-file evidence through the supported State surface.",
      "contract_version": "1.0.0",
      "operation_digest": "sha256:613055013cf7056d88b5bfa4b73778188c2013f2e46f86916b4c4ef661f40228",
      "effect": "state_mutation",
      "execution": {"kind": "bridge_adapter", "bridge_adapter": "state.cli.submit_evidence", "transport": "state_cli", "deadline_seconds": 120},
      "input_schema": {"type": "object", "required": ["task_id", "verification_receipt_ids"], "properties": {"task_id": {"type": "string"}, "verification_receipt_ids": {"type": "array", "minItems": 1, "items": {"type": "string"}}}, "additionalProperties": false},
      "output_schema": {"type": "object", "required": ["event_id"], "properties": {"event_id": {"type": "string"}}},
      "preconditions": ["bridge.lease_valid", "work_packet.digest_matches", "verification.passed", "packet.declared_change_exists"],
      "gates": {"preview": "not_supported", "confirmation": "not_required", "human_approval": "not_required", "approval_action": null},
      "idempotency": {"key_scope": "run_step", "replay": "return_prior_receipt", "max_attempts": 1},
      "receipts": ["state_evidence", "state_event"],
      "failure": "reconcile",
      "docs": "docs/CONTRACTS.md#state-writes"
    }
  ]
}
